### ISSUE TITLE
Some WebClient HTTP requests are not traced

### ISSUE THREAD

**Issue by eungjun-yi** [naver/pinpoint#5782]
#### What version of pinpoint are you using?

master

#### Describe the bug

Some WebClient HTTP requests are not traced.

#### What did you do to trigger the bug?

Run an application, which makes some WebClient HTTP requests, with agent attached.

```kotlin
fun route() = router {
    GET("/") {
        val example = WebClient.builder().baseUrl("http://www.example.org").build()
        val cern = WebClient.builder().baseUrl("http://info.cern.ch/").build()
        val gnu = WebClient.builder().baseUrl("http://www.gnufoundation.org/").build()

        val body = Mono.zip(
            example.get().exchange().flatMap {
                cern.get().exchange().map { "hello" }
            },
            gnu.get().exchange()
        ).map {
            it.t1
        }

        ServerResponse.ok().body(
            body,
            String::class.java
        )
    }
}
```

#### Expected behavior

All of the requests are traced.

#### Actual behavior

The request to "http://info.cern.ch/" is not traced.

#### Screenshots

![image](https://user-images.githubusercontent.com/1129852/61172855-cbeda400-a5c5-11e9-8224-b7f5f293a809.png)

This is the tcpdump which shows the HTTP request to "http://info.cern.ch/" doesn't have Pinpoint-* headers.

```
tcpdump: listening on wlp0s20f3, link-type EN10MB (Ethernet), capture size 262144 bytes
23:22:49.999063 IP (tos 0x0, ttl 64, id 20042, offset 0, flags [DF], proto TCP (6), length 60)
    192.168.0.40.51264 > 198.49.23.145.80: Flags [S], cksum 0x9ec1 (incorrect -> 0xcbbb), seq 2798420987, win 64240, options [mss 1460,sackOK,TS val 38858007 ecr 0,nop,wscale 7], length 0
23:22:50.318872 IP (tos 0x0, ttl 64, id 20043, offset 0, flags [DF], proto TCP (6), length 52)
    192.168.0.40.51264 > 198.49.23.145.80: Flags [.], cksum 0x9eb9 (incorrect -> 0xf1f0), ack 3776666734, win 502, options [nop,nop,TS val 38858327 ecr 1738038047], length 0
23:22:50.349955 IP (tos 0x0, ttl 64, id 20044, offset 0, flags [DF], proto TCP (6), length 400)
    192.168.0.40.51264 > 198.49.23.145.80: Flags [P.], cksum 0xa015 (incorrect -> 0x602f), seq 0:348, ack 1, win 502, options [nop,nop,TS val 38858358 ecr 1738038047], length 348: HTTP, length: 348
	GET / HTTP/1.1
	accept-encoding: gzip
	user-agent: ReactorNetty/0.8.9.RELEASE
	host: www.gnufoundation.org
	accept: */*
	Pinpoint-TraceID: test^1563027750898^1
	Pinpoint-SpanID: 8704248251218948325
	Pinpoint-pSpanID: -5597830552123829149
	Pinpoint-Flags: 0
	Pinpoint-pAppName: test
	Pinpoint-pAppType: 1000
	Pinpoint-Host: www.gnufoundation.org
	
23:22:50.694570 IP (tos 0x0, ttl 64, id 20045, offset 0, flags [DF], proto TCP (6), length 52)
    192.168.0.40.51264 > 198.49.23.145.80: Flags [.], cksum 0x9eb9 (incorrect -> 0xc18c), ack 11366, win 414, options [nop,nop,TS val 38858703 ecr 1738038434], length 0
23:22:50.915556 IP (tos 0x0, ttl 64, id 20046, offset 0, flags [DF], proto TCP (6), length 52)
    192.168.0.40.51264 > 198.49.23.145.80: Flags [.], cksum 0x9eb9 (incorrect -> 0xa8c7), ack 17335, win 368, options [nop,nop,TS val 38858924 ecr 1738038631], length 0
23:22:51.778126 IP (tos 0x0, ttl 64, id 65283, offset 0, flags [DF], proto TCP (6), length 60)
    192.168.0.40.56986 > 93.184.216.34.80: Flags [S], cksum 0xf6d9 (incorrect -> 0x449d), seq 2027040878, win 64240, options [mss 1460,sackOK,TS val 3271280287 ecr 0,nop,wscale 7], length 0
23:22:51.923410 IP (tos 0x0, ttl 64, id 65284, offset 0, flags [DF], proto TCP (6), length 52)
    192.168.0.40.56986 > 93.184.216.34.80: Flags [.], cksum 0xf6d1 (incorrect -> 0xc7de), ack 3511830614, win 502, options [nop,nop,TS val 3271280433 ecr 2416376371], length 0
23:22:51.926175 IP (tos 0x0, ttl 64, id 65285, offset 0, flags [DF], proto TCP (6), length 388)
    192.168.0.40.56986 > 93.184.216.34.80: Flags [P.], cksum 0xf821 (incorrect -> 0xbaee), seq 0:336, ack 1, win 502, options [nop,nop,TS val 3271280435 ecr 2416376371], length 336: HTTP, length: 336
	GET / HTTP/1.1
	accept-encoding: gzip
	user-agent: ReactorNetty/0.8.9.RELEASE
	host: www.example.org
	accept: */*
	Pinpoint-TraceID: test^1563027750898^1
	Pinpoint-SpanID: 2401578945183792613
	Pinpoint-pSpanID: -5597830552123829149
	Pinpoint-Flags: 0
	Pinpoint-pAppName: test
	Pinpoint-pAppType: 1000
	Pinpoint-Host: www.example.org
	
23:22:52.094707 IP (tos 0x0, ttl 64, id 65286, offset 0, flags [DF], proto TCP (6), length 52)
    192.168.0.40.56986 > 93.184.216.34.80: Flags [.], cksum 0xf6d1 (incorrect -> 0xc18e), ack 968, win 495, options [nop,nop,TS val 3271280604 ecr 2416376520], length 0
23:22:54.011041 IP (tos 0x0, ttl 64, id 10922, offset 0, flags [DF], proto TCP (6), length 60)
    192.168.0.40.58412 > 188.184.64.53.80: Flags [S], cksum 0xbdec (incorrect -> 0x8ad7), seq 2378824502, win 64240, options [mss 1460,sackOK,TS val 2138445702 ecr 0,nop,wscale 7], length 0
23:22:54.345317 IP (tos 0x0, ttl 64, id 10923, offset 0, flags [DF], proto TCP (6), length 52)
    192.168.0.40.58412 > 188.184.64.53.80: Flags [.], cksum 0xbde4 (incorrect -> 0x8be6), ack 2211215387, win 502, options [nop,nop,TS val 2138446037 ecr 367137679], length 0
23:22:54.347082 IP (tos 0x0, ttl 64, id 10924, offset 0, flags [DF], proto TCP (6), length 166)
    192.168.0.40.58412 > 188.184.64.53.80: Flags [P.], cksum 0xbe56 (incorrect -> 0x0e82), seq 0:114, ack 1, win 502, options [nop,nop,TS val 2138446038 ecr 367137679], length 114: HTTP, length: 114
	GET / HTTP/1.1
	accept-encoding: gzip
	user-agent: ReactorNetty/0.8.9.RELEASE
	host: info.cern.ch
	accept: */*
	
23:22:54.797040 IP (tos 0x0, ttl 64, id 10925, offset 0, flags [DF], proto TCP (6), length 52)
    192.168.0.40.58412 > 188.184.64.53.80: Flags [.], cksum 0xbde4 (incorrect -> 0x84ed), ack 888, win 496, options [nop,nop,TS val 2138446488 ecr 367138018], length 0
23:22:54.842158 IP (tos 0x0, ttl 64, id 10926, offset 0, flags [DF], proto TCP (6), length 52)
    192.168.0.40.58412 > 188.184.64.53.80: Flags [.], cksum 0xbde4 (incorrect -> 0x84ba), ack 889, win 501, options [nop,nop,TS val 2138446533 ecr 367138018], length 0
23:22:54.856451 IP (tos 0x0, ttl 64, id 10927, offset 0, flags [DF], proto TCP (6), length 52)
    192.168.0.40.58412 > 188.184.64.53.80: Flags [F.], cksum 0xbde4 (incorrect -> 0x84aa), seq 114, ack 889, win 501, options [nop,nop,TS val 2138446548 ecr 367138018], length 0
```

#### Additional context

I'm using jetty instead of netty because pinpoint seems not tracing any HTTP request when I'm using netty.

```gradle
implementation("org.springframework.boot:spring-boot-starter-jetty")
```

**Comment by eungjun-yi** [comment]
It seems that any HTTP request sent by other thread is not traced.

**Comment by koo-taejin** [comment]
hi @eungjun-yi 

By default, if the thread changes, the trace is not possible. 

These traces are possible on plugins that are supported by pinpoint.
Because plugin handing Trace over to another thread.
If you want to trace in you're code, then  you have to implement your own plugin.

The following are the plugin sample projects:
https://github.com/naver/pinpoint-plugin-sample

thanks.

**Comment by eungjun-yi** [comment]
Pinpoint already has a [WebFlux plugin](https://github.com/naver/pinpoint/commit/60a1cba397390c89f043d26603d254e984f9e442) and it seems to be [designed to trace async HTTP requests](https://github.com/naver/pinpoint/commit/60a1cba397390c89f043d26603d254e984f9e442#diff-c97424fbd47a56a15c0dfa1f76c56eddR38). So I think it's a bug because the feature doesn't work as expected.

**Comment by emeroad** [comment]
Unfortunately, the webflux plugin does not yet support flux and mono.
As a result, the asynchronous logic of webflux is not yet tracked.

**Comment by dinesh4747** [comment]
@emeroad @koo-taejin @Xylus @RoySRose @jaehong-kim - In context to this thread and associated below list of issues

a) https://github.com/naver/pinpoint/issues/6352
b) https://github.com/naver/pinpoint/issues/5949

Just wanted to understand and clarity on whether the current/latest version of Pinpoint (2RC2) supports flux and mono calls or not ?
